{
  "$schema": "../schemas/scenario.schema.json",
  "schemaVersion": "1.0",
  "key": "auth.scenario.password.complete-profile",
  "name": "Complete Password Registration Profile",
  "summary": "Completes required registration profile data after email ownership is verified.",
  "version": 1,
  "maturity": "proposed",
  "scenarioType": "integration",
  "journeyKeys": ["auth.journey.password.registration"],
  "transitionKey": "auth.transition.password.complete-profile",
  "preconditions": { "expression": "pending-identity-status == resolution-required and pending-identity-flow == password and email-ownership == verified and profile-completeness in [unknown,incomplete]" },
  "setup": [],
  "inputs": [{ "key": "profile", "valueType": "object", "required": true }],
  "actionKey": "auth.action.password.complete-profile",
  "postconditions": { "expression": "profile-completeness == complete and durable-identity == absent and session-capability == identity-ceremony" },
  "requiredEffects": ["validate-registration-profile", "persist-registration-profile"],
  "forbiddenEffects": ["create-durable-user", "establish-password", "grant-normal-application-authorization"],
  "invariantKeys": ["auth.invariant.pending-identity.no-normal-authorization", "auth.invariant.pending-identity.exactly-one-flow"],
  "expectedAuthLogEvents": [],
  "evidenceRequirements": ["server", "web", "android", "ios", "vtm"],
  "sourceReferences": [{ "sourceType": "discussion", "reference": "AUTH-MODEL-GUIDE.md", "section": "4.6" }]
}