{
  "$schema": "../schemas/scenario.schema.json",
  "schemaVersion": "1.0",
  "key": "auth.scenario.password.create-durable-user",
  "name": "Create Password Durable User",
  "summary": "Creates exactly one durable user after all password registration proof and profile requirements are satisfied.",
  "version": 1,
  "maturity": "proposed",
  "scenarioType": "integration",
  "journeyKeys": ["auth.journey.password.registration"],
  "transitionKey": "auth.transition.password.create-durable-user",
  "preconditions": { "expression": "pending-identity-status == resolution-required and pending-identity-flow == password and email-ownership == verified and profile-completeness == complete and credential-proof == password-proved and durable-identity == creation-required and account-status == absent and home-workspace == not-applicable" },
  "setup": ["Ensure no canonical durable identity already matches the registration identity."],
  "inputs": [{ "key": "pending-identity-reference", "valueType": "reference", "required": true }],
  "actionKey": "auth.action.password.create-durable-user",
  "postconditions": { "expression": "durable-identity == resolved and account-status == active and home-workspace == required and session-capability == identity-ceremony" },
  "requiredEffects": ["resolve-canonical-identity", "create-durable-user-once", "record-durable-user-created"],
  "forbiddenEffects": ["create-duplicate-durable-user", "create-home-workspace", "grant-normal-application-authorization"],
  "invariantKeys": ["auth.invariant.identity-resolution.no-duplicate-user", "auth.invariant.pending-identity.no-normal-authorization", "auth.invariant.home-workspace.exactly-one"],
  "expectedAuthLogEvents": ["durable-user-created"],
  "evidenceRequirements": ["server", "web", "android", "ios", "vtm"],
  "sourceReferences": [{ "sourceType": "discussion", "reference": "AUTH-MODEL-GUIDE.md", "section": "4.6" }]
}