{
  "$schema": "../schemas/scenario.schema.json",
  "schemaVersion": "1.0",
  "key": "auth.scenario.password.verify-email",
  "name": "Verify Password Registration Email",
  "summary": "Consumes the active email verification proof and establishes verified ownership.",
  "version": 1,
  "maturity": "proposed",
  "scenarioType": "integration",
  "journeyKeys": ["auth.journey.password.registration"],
  "transitionKey": "auth.transition.password.verify-email",
  "preconditions": { "expression": "pending-identity-status == verification-required and pending-identity-flow == password and email-ownership == verification-pending" },
  "setup": ["Issue a valid email verification proof bound to the PendingIdentity."],
  "inputs": [{ "key": "verification-proof", "valueType": "secret-reference", "required": true }],
  "actionKey": "auth.action.password.verify-email",
  "postconditions": { "expression": "email-ownership == verified and pending-identity-status == resolution-required and session-capability == identity-ceremony" },
  "requiredEffects": ["consume-email-verification-proof", "record-email-ownership-verified"],
  "forbiddenEffects": ["reuse-verification-proof", "create-durable-user", "grant-normal-application-authorization"],
  "invariantKeys": ["auth.invariant.pending-identity.no-normal-authorization", "auth.invariant.email-identities.not-conflated"],
  "expectedAuthLogEvents": ["email-ownership-verified"],
  "evidenceRequirements": ["server", "web", "android", "ios", "vtm"],
  "sourceReferences": [{ "sourceType": "discussion", "reference": "AUTH-MODEL-GUIDE.md", "section": "4.6" }]
}