{
  "$schema": "../schemas/scenario.schema.json",
  "schemaVersion": "1.0",
  "key": "auth.scenario.guest.activate",
  "name": "Activate Guest Identity",
  "summary": "Establishes a resumable guest identity without creating or resolving a durable user.",
  "version": 1,
  "maturity": "proposed",
  "scenarioType": "integration",
  "journeyKeys": ["auth.journey.guest.claimable-value"],
  "transitionKey": "auth.transition.guest.activate",
  "preconditions": { "expression": "guest-identity == none and durable-identity == absent and claimable-value == none" },
  "setup": ["Ensure no active guest identity exists for the client session."],
  "inputs": [
    { "key": "client-session-reference", "valueType": "reference", "required": true, "description": "Opaque reference to the client session requesting anonymous participation." }
  ],
  "actionKey": "auth.action.guest.activate",
  "postconditions": { "expression": "guest-identity == active and durable-identity == absent and claimable-value == none" },
  "requiredEffects": ["create-resumable-guest-session"],
  "forbiddenEffects": ["create-durable-user", "grant-normal-application-authorization"],
  "invariantKeys": ["auth.invariant.transition.one-state-changing-action", "auth.invariant.transition.deterministic-post-state"],
  "expectedAuthLogEvents": ["guest-session-established"],
  "evidenceRequirements": ["server", "web", "android", "ios", "vtm"],
  "sourceReferences": [{ "sourceType": "discussion", "reference": "AUTH-MODEL-GUIDE.md", "section": "4.4" }]
}